exports,description,hs-code,tariff,export_share,color
72252603.0,"CHICKENS, LIVE, WEIGHING NOT OVER 185 G EACH",010511,25.0,21.071611708696857,#ff0000
1302235.0,"CHICKENS, LIVE, WEIGHING MORE THAN 185 G EACH",010594,25.0,97.40829975397996,#ff0000
0.0, ,010599,25.0,0.0,#EE1C25
3436451.0,"MEAT & OFFAL OF CHICKENS,NOT CUT FRESH OR CHILLED",020711,25.0,26.563670970019533,#ff0000
854311.0,"MEAT & OFFAL OF CHICKENS,NOT CUT IN PIECES,FROZEN",020712,25.0,4.93616179909485,#ff0000
343509174.0,CHICKEN CUTS & EDIBLE OFFAL (INCL LIVER) FRSH/CHLD,020713,25.0,33.84348133824168,#ff0000
43184591.0,"CHICKEN CUTS AND EDIBLE OFFAL (INC LIVERS), FROZEN",020714,25.0,1.3218675977277006,#ff0000
0.0, ,020724,25.0,0.0,#EE1C25
0.0, ,020725,25.0,0.0,#EE1C25
1552065.0,TURKEY CUTS & EDIBLE OFFAL (INCL LIVER) FRSH/CHLLD,020726,25.0,0.6583205885556955,#ff0000
6063060.0,TURKEY CUTS AND EDIBLE OFFAL (INCLUD LIVER) FROZEN,020727,25.0,4.51817225100797,#ff0000
0.0, ,020990,25.0,0.0,#EE1C25
446227.0,"MEAT&OFFAL,SALT,IN BRINE,DRD,SMK,INCL FLR ETC,NESO",021099,25.0,2.906386159404658,#ff0000
574930.0,"MILK AND CREAM, NT CONCNTRD, NT SWEETD, NOV 1% FAT",040110,25.0,13.779362903691617,#ff0000
47002492.0,"MILK/CREAM NT CNCTRD/SWT, FAT CONTENT OV 1% NOV-6%",040120,25.0,48.30590809747648,#ff0000
128670.0,MILK & CREAM FAT CONT 6-10% NOT CONCENT OR SWEETEN,040140,25.0,0.6177953583484357,#ff0000
14881021.0,"MILK & CREAM FAT CONT GT 10%, NOT CONCENT OR SWEET",040150,25.0,45.0958437606529,#ff0000
7093097.0,"MLK & CRM,CNTD,SWT,POWDR,GRAN/SOLIDS,NOV 1.5% FAT",040210,25.0,0.34703723332890163,#ff0000
11885966.0,MLK/CREAM CNCTRD NT SWTN PWD/OTH SOLIDS OV 1.5% FA,040221,25.0,14.933022138614147,#ff0000
0.0, ,040229,25.0,0.0,#EE1C25
331708.0,"MILK AND CREAM, CONCENTRATED, NOT SWEETENED, NESOI",040291,25.0,1.0734939537566657,#ff0000
7265.0,"MILK AND CREAM, SWEETENED, CONCEN OR NOT NESOI",040299,25.0,0.04656904410450644,#ff0000
2963360.0,YOGURT,040320,25.0,3.5453892944188845,#ff0000
2467903.0,BUTTERMILK/KEPHIR/CURDLED FERMNTD ACIDFD MLK & CRM,040390,25.0,3.3127572773251672,#ff0000
61872494.0,WHEY & MODFD WHEY WHET/NT CNCNTRTD CNTG ADD SWEETN,040410,25.0,10.148120220483603,#ff0000
22236056.0,"PRODUCTS OF NATURAL MILK CONSTITUENTS, NESOI",040490,25.0,9.48805561730926,#ff0000
141754211.0,BUTTER,040510,25.0,68.76601163557179,#ff0000
0.0, ,040520,25.0,0.0,#EE1C25
12032191.0,"FATS AND OILS DERIVED FROM MILK, N.E.S.O.I.",040590,25.0,42.304497397358375,#ff0000
24278670.0,CHEESE (UNRPND/UNCURD) FRSH INCL WHEY CHEESE CURD,040610,25.0,4.139962530809198,#ff0000
21290475.0,"CHEESE OF ALL KINDS, GRATED OR POWDERED",040620,25.0,2.8949367525976997,#ff0000
3888005.0,"CHEESE, PROCESSED, NOT GRATED OR POWDERED",040630,25.0,2.850809116585471,#ff0000
762860.0,"CHEESE, BLUE-VEINED, NESOI",040640,25.0,30.09676524673027,#ff0000
91880851.0,"CHEESE, NESOI, INCLUDING CHEDDAR AND COLBY",040690,25.0,9.086434988230833,#ff0000
70277717.0,"EGGS OF CHICKENS, FERTILIZED FOR INCUBATION",040711,25.0,18.00383911293873,#ff0000
144008703.0,"EGGS OF CHICKENS, FRESH, NESOI",040721,25.0,79.7187995185054,#ff0000
26481.0,"BIRDS' EGGS, IN SHELL, PRESERVED OR COOKED",040790,25.0,0.2929312539097047,#ff0000
142480.0,"EGG YOLKS, DRIED, WHETHER OR NOT SWEETENED",040811,25.0,0.7394278630202619,#ff0000
1076836.0,"EGG YOLKS, FRSH, FRZN, COOKED BY WATER, MOLDED ETC",040819,25.0,2.2905252002100545,#ff0000
781756.0,"BIRDS' EGGS NT IN SHELL, FRSH FRZN COOKD WATER ETC",040899,25.0,10.240335254279294,#ff0000
15145613.0,"HONEY, NATURAL",040900,25.0,57.50024781622746,#ff0000
408120654.0,"TOMATOES, FRESH OR CHILLED",070200,25.0,95.26833948486434,#ff0000
61161226.0,"BEANS (VIGNA SPP., PHASEOLUS SPP.) FRESH OR CHILLD",070820,25.0,78.29832775227827,#ff0000
60121376.0,"NUTS, FRESH OR DRIED, NESOI",080299,25.0,13.168265615343294,#ff0000
115338547.0,"ORANGES, FRESH",080510,25.0,22.10974241612815,#ff0000
44070726.0,"MANDARINS (INCL TANGERINES AND SATSUMAS), FRESH/DR",080521,25.0,46.78657981711579,#ff0000
17217402.0,"CLEMENTINES, FRESH OR DRIED",080522,25.0,70.35978317743687,#ff0000
2758308.0,"WILKINGS AND SIMILAR CITRUS HYBRIDS, FRESH OR DRD",080529,25.0,31.531793942730573,#ff0000
8790954.0,"GRAPEFRUIT AND POMELOS, FRESH OR DRIED",080540,25.0,28.174720461146087,#ff0000
97703193.0,"LEMONS AND LIMES, FRESH OR DRIED",080550,25.0,52.08949264567584,#ff0000
159768161.0,"WATERMELONS, FRESH",080711,25.0,96.67401731261158,#ff0000
85463283.0,"PEACHES, INCLUDING NECTARINES, FRESH",080930,25.0,51.302993758659674,#ff0000
20379839.0,RASPBERRIES/BLCKBERRIES/ETC UNCOOKD/COOKD WATER FZ,081120,25.0,67.9545579812842,#ff0000
199132233.0,"COFFEE, NOT ROASTED, NOT DECAFFEINATED",090111,25.0,86.50974898938888,#ff0000
3679114.0,"COFFEE, NOT ROASTED, DECAFFEINATED",090112,25.0,60.97234536556586,#ff0000
454226315.0,"COFFEE, ROASTED, NOT DECAFFEINATED",090121,25.0,58.580047766617525,#ff0000
31573779.0,"COFFEE, ROASTED, DECAFFEINATED",090122,25.0,54.81861022721305,#ff0000
1742877.0,"COFFEE SUBSTITUTES WITH COFFEE;COFFEE HUSKS,SKINS",090190,25.0,19.69717106962848,#ff0000
16761229.0,GREEN TEA NT FERMTD IN IMMED PACKG CONTENT NOV 3KG,090210,25.0,49.445201211283205,#ff0000
4109925.0,GREEN TEA (NOT FERMENTED) NESOI,090220,25.0,62.68815369036337,#ff0000
22316850.0,"BLACK TEA FERMTD & PARTLY FERMTD TEA,PACKG NOV 3KG",090230,25.0,46.123495357331144,#ff0000
6332644.0,BLACK TEA FERMDT & OTHER PARTLY FERMENTD TEA NESOI,090240,25.0,75.05965225028639,#ff0000
189518.0,MATE,090300,25.0,64.43494728395943,#ff0000
7769263.0,"PEPPER OF GENUS PIPER, NEITHER CRUSHED NOR GROUND",090411,25.0,53.42203332269605,#ff0000
20409218.0,"PEPPER OF THE GENUS PIPER, CRUSHED OR GROUND",090412,25.0,61.48701607171305,#ff0000
2948108.0,"CAPSICUM (PEPPERS) OR PIMENTA (ALLSPICE), DRIED",090421,25.0,55.42561761672935,#ff0000
15148623.0,"CAPSICUM/PEPPERS, PIMENTA/ALLSPICE, CRUSHED/GROUND",090422,25.0,55.69082569245797,#ff0000
2686304.0,"VANILLA, NEITHER CRUSHED NOR GROUND",090510,25.0,56.177168510133015,#ff0000
662438.0,"VANILLA, CRUSHED OR GROUND",090520,25.0,19.47975797553878,#ff0000
420541.0,"CINNAMON, NEITHER CRUSHED NOR GROUND",090611,25.0,32.840090209687546,#ff0000
1136549.0,"CINNAMON-TREE FLOWERS, NEITHER CRUSHED NOR GROUND",090619,25.0,64.9914482604029,#ff0000
9269984.0,"CINNAMON & CINNAMON-TREE FLOWERS, CRUSHD OR GROUND",090620,25.0,61.834046338260826,#ff0000
604846.0,"CLOVES, NEITHER CRUSHED NOR GROUND",090710,25.0,74.82023109875198,#ff0000
549958.0,"CLOVES, CRUSHED OR GROUND",090720,25.0,78.73978094351779,#ff0000
116677.0,"NUTMEG, NEITHER CRUSHED NOR GROUND",090811,25.0,70.28015203262316,#ff0000
1244315.0,"NUTMEG, CRUSHED OR GROUND",090812,25.0,65.11502923416586,#ff0000
25371.0,"MACE, NEITHER CRUSHED NOR GROUND",090821,25.0,59.10954755137225,#ff0000
76874.0,"MACE, CRUSHED OR GROUND",090822,25.0,60.611842623984856,#ff0000
256388.0,"CARDAMOMS, NEITHER CRUSHED NOR GROUND",090831,25.0,25.566523438240097,#ff0000
318428.0,"CARDAMOMS, CRUSHED OR GROUND",090832,25.0,56.98700545659865,#ff0000
434337.0,"CORIANDER SEEDS, NEITHER CRUSHED NOR GROUND",090921,25.0,23.227148903128096,#ff0000
698816.0,"CORIANDER SEEDS, CRUSHED OR GROUND",090922,25.0,60.007848585837685,#ff0000
276490.0,"CUMIN SEEDS, NEITHER CRUSHED NOR GROUND",090931,25.0,35.80358981198874,#ff0000
2662247.0,"CUMIN SEEDS, CRUSHED OR GROUND",090932,25.0,72.85268703506675,#ff0000
1096249.0,ANISE BADIAN ETC JUNIPER BERRIES NT CRUSHED/GROUND,090961,25.0,75.84608678806663,#ff0000
148043.0,ANISE BADIAN SEED ETC JUNIPER BERRIES CRUSH/GROUND,090962,25.0,15.289275829305573,#ff0000
9435980.0,"GINGER, NEITHER CRUSHED NOR GROUND",091011,25.0,91.20616445175177,#ff0000
1447596.0,"GINGER, CRUSHED OR GROUND",091012,25.0,31.140023580953425,#ff0000
447952.0,SAFFRON,091020,25.0,39.17119559276829,#ff0000
2640524.0,TUMERIC (CURCUMA),091030,25.0,53.80193122828866,#ff0000
2429025.0,MIXTURES OF SPICES PROVIDED FOR IN DIFF HEADINGS,091091,25.0,27.869908415765188,#ff0000
8578979.0,"SPICES, NESOI",091099,25.0,22.9880940459994,#ff0000
602662.0,"DURUM WHEAT, NESOI",100119,25.0,0.29037159910572247,#ff0000
23234878.0,"WHEAT AND MESLIN, NESOI",100199,25.0,0.40399135624144883,#ff0000
628546.0,"RYE, NESOI",100290,25.0,99.19513419164645,#ff0000
27623865.0,"BARLEY, NESOI",100390,25.0,66.39100469591754,#ff0000
3143463.0,"OATS, NESOI",100490,25.0,28.378178183473697,#ff0000
26078448.0,"RICE, HUSKED (BROWN)",100620,25.0,11.950336687322213,#ff0000
147624086.0,"RICE, SEMI- OR WHOLLY MILLED, POLISHED ETC OR NOT",100630,25.0,10.786551274562498,#ff0000
52973949.0,WHEAT OR MESLIN FLOUR,110100,25.0,35.058097565679546,#ff0000
153758091.0,LOW ERUCIC ACID RAPE/COLZA SEEDS W/NOT BROKEN,120510,25.0,76.70894992380471,#ff0000
63482337.0,"VEGETABLE SAPS AND EXTRACTS, NESOI",130219,25.0,22.488766844074707,#ff0000
73970185.0,"FISH FATS & OILS (NOT LIVER), FRACT, NOT MODIFIED",150420,25.0,35.84766578098551,#ff0000
872113.0,"PEANUT (GROUND-NUT) OIL, CRUDE, NT CHEM MODIFIED",150810,25.0,18.729565513200917,#ff0000
124476314.0,"PALM OIL, REFINED BUT NOT CHEMICALLY MODIFIED",151190,25.0,83.99095402514276,#ff0000
47762393.0,"SUNFLOWER-SEED OR SAFFLOWER OIL, REFINE, FRACT ETC",151219,25.0,72.62403650628619,#ff0000
2264872.0,"RAPESEED/COLZA OIL & FRACTIONS, LW ERUCIC ACID,CRD",151411,25.0,12.031813807331778,#ff0000
25169774.0,"RAPESEED/COLZA OIL & FRACTIONS, LW ERUCIC ACID,NES",151419,25.0,39.16500943920991,#ff0000
75969.0,"RAPESED,COLZA,MSTRD OIL & FRAC THEREOF,CRUDE,NESOI",151491,25.0,17.446490905750505,#ff0000
2053024.0,"RAPESED,COLZA,MSTRD OIL & FRAC THEREOF,NESOI",151499,25.0,18.942542395322455,#ff0000
3702317.0,"MARGARINE, EXCLUDING LIQUID MARGARINE",151710,25.0,8.09072629532757,#ff0000
118435538.0,"EDIBLE FATS & OIL MIXTURES & PREPAR NESOI, ETC",151790,25.0,42.82373187694955,#ff0000
277359047.0,"SAUSAGE ETC OF MEAT,OFFAL,BLOOD,INSECTS;FOOD PREPS",160100,25.0,32.038170108537784,#ff0000
26328.0,"HOMOGENIZED PREPS OF MEAT, MEAT OFFAL OR BLOOD",160210,25.0,1.341908335550479,#ff0000
343915.0,"ANIMAL LIVERS, PREPARED OR PRESERVED, NESOI",160220,25.0,69.87344498239526,#ff0000
10001122.0,"PREPARED OR PRESERVED TURKEY MEAT, NESOI",160231,25.0,11.302330488159,#ff0000
107511097.0,"PREPARED OR PRESERVED CHICKEN MEAT OR OFFAL, NESOI",160232,25.0,26.132096509361403,#ff0000
238225.0,"PREPARED ETC. POULTRY MEAT, EXCEPT TURKEY, NESOI",160239,25.0,17.008951967247995,#ff0000
7212230.0,SHRIMP & PRAWNS PREP/PRESERVED NOT AIRTIGHT CONTNR,160521,25.0,12.88646020173528,#ff0000
83452.0,"BEET SUGAR, RAW, SOLID FORM, W/O ADDED FLAV/COLOR",170112,25.0,3.9608170905754747,#ff0000
55619.0,CANE SUGAR SOLID RAW NO ADDED FLAV/COLOR SUBH NT 2,170113,25.0,7.4341546871971715,#ff0000
2684177.0,"CANE SUGAR, SOLID, RAW, NO ADDED FLAV/COLOR, NESOI",170114,25.0,14.006702004991881,#ff0000
5526869.0,"CANE/BEET SUGAR, REFINED, SOLID, ADDED FLAV/COLOR",170191,25.0,20.807415370881486,#ff0000
9994434.0,CANE/BEET SUG CHEM PURE SUCROSE REFIND NESOI,170199,25.0,3.0204162447263325,#ff0000
8593516.0,MAPLE SUGAR AND MAPLE SYRUP,170220,25.0,18.266624584885964,#ff0000
6633146.0,CANE MOLASSES FROM EXTRACTION OR REFINING OF SUGAR,170310,25.0,19.70571720295013,#ff0000
10421729.0,"MOLASSES FROM EXTRACTION/REFING SUGAR, NESOI",170390,25.0,80.4646114431806,#ff0000
10364710.0,"CHEWING GUM, WHETHER OR NOT SUGAR COATED",170410,25.0,19.716330280618504,#ff0000
381751017.0,"SUGAR CONFECTION (INCL WH CHOC), NO COCOA, NESOI",170490,25.0,52.25252857764274,#ff0000
326154021.0,"CHOCOLATE PREP NESOI, IN BLOCKS ETC. OVER 2 KG",180620,25.0,63.20721742292454,#ff0000
75118199.0,"CHOCOLATE & OTHR COCOA PREPS, NOT BULK, FILLED",180631,25.0,39.53820615510728,#ff0000
410705788.0,"COCOA PREPARATIONS, NOT IN BULK FORM, NESOI",180690,25.0,34.60073270024899,#ff0000
247415520.0,MIXES & DOUGHS FOR PREP OF BAKERS WARES HDG 1905,190120,25.0,39.40002701646762,#ff0000
206218187.0,"MALT EXTRACT; FLOUR, MEAL, MILK ETC PROD ETC NESOI",190190,25.0,53.619118467005364,#ff0000
5237017.0,"PASTA, UNCOOKED, NOT STUFFED ETC., CONTAINING EGGS",190211,25.0,40.00266581727159,#ff0000
113964567.0,"PASTA, UNCOOKED, NOT STUFFED ETC., NESOI",190219,25.0,63.58532866059782,#ff0000
156440739.0,"PASTA, PREPARED NESOI",190230,25.0,85.36088848806638,#ff0000
1327189335.0,"BREAD, PASTRY, CAKES, ETC NESOI & PUDDINGS",190590,25.0,61.12908603587377,#ff0000
76041403.0,"CUCUMBERS, GHERKINS, PREP/PRES VINEGAR/ACETIC ACID",200110,25.0,75.71052604513024,#ff0000
72593080.0,"PEANUTS, PREPARED OR PRESERVED, NESOI",200811,25.0,28.532724805672636,#ff0000
149953392.0,"ORANGE JUICE, NOT FROZEN,OF A BRIX VALUE NOT OV 20",200912,25.0,82.68137251326097,#ff0000
37690545.0,SOY SAUCE,210310,25.0,50.84928752193122,#ff0000
203669116.0,TOMATO KETCHUP AND OTHER TOMATO SAUCES,210320,25.0,47.05810781260539,#ff0000
28901519.0,MUSTARD FLOUR AND MEAL AND PREPARED MUSTARD,210330,25.0,30.998947464071858,#ff0000
625345555.0,SAUCES ETC. MIXED CONDIMENTS AND SEASONINGS NESOI,210390,25.0,35.98649236041274,#ff0000
288223405.0,SOUPS AND BROTHS AND PREPARATIONS THEREFOR,210410,25.0,31.553931260720624,#ff0000
16882972.0,"ICE CREAM AND OTHER EDIBLE ICE, WITH COCOA OR NOT",210500,25.0,6.935098115739795,#ff0000
1591995104.0,FOOD PREPARATIONS NESOI,210690,25.0,24.606499707007252,#ff0000
389471520.0,"WATERS, INCL MINERAL & AERATED, SWEETND OR FLAVORD",220210,25.0,57.69399548045073,#ff0000
483214318.0,"NONALCOHOLIC BEVERAGES, NESOI",220299,25.0,54.04003788291237,#ff0000
41273692.0,BEER MADE FROM MALT,220300,25.0,10.736369603777428,#ff0000
8550544.0,SPARKLING WINE OF FRESH GRAPES,220410,25.0,20.615638307919163,#ff0000
390079017.0,"WINE, FR GRAPE NESOI & GR MUST W ALC, NOV 2 LITERS",220421,25.0,38.86014780146984,#ff0000
11308015.0,"WINE, FR GRAPE NEOIS & GR MUST W ALC, 2-10 LITERS",220422,25.0,40.43689308757833,#ff0000
12213543.0,"WINE, FR GRAPE NESOI & GR MUST WITH ALC, NESOI",220429,25.0,6.850916356128129,#ff0000
0.0, ,220430,25.0,0.0,#EE1C25
29985.0,VERMOUTH/GRPE WINE FLAVORED WTH PLANTS ETC CTR 2L<,220510,25.0,0.23082174233811917,#ff0000
0.0, ,220590,25.0,0.0,#EE1C25
17540331.0,"FERMENTED BEVERAGES NESOI (CIDER, PERRY, MEAD ETC)",220600,25.0,40.28372944230778,#ff0000
670744.0,GRAPE BRANDY,220820,25.0,0.353082860489784,#ff0000
80552282.0,WHISKIES,220830,25.0,5.250003031456837,#ff0000
55505634.0,RUM AND TAFIA,220840,25.0,40.02303477624899,#ff0000
2604389.0,GIN AND GENEVA,220850,25.0,2.6714608602404946,#ff0000
26458251.0,VODKA,220860,25.0,8.66319113309418,#ff0000
33446657.0,LIQUEURS AND CORDIALS,220870,25.0,8.575480126178048,#ff0000
105754111.0,"CORDIALS, LIQUEURS, KIRSCHWASSER, RATAFIA, ETC.",220890,25.0,37.44033897062493,#ff0000
287646934.0,"ANIMAL FEED PREP EXCEPT DOG OR CAT FOOD, RETAIL PK",230990,25.0,17.12472188141671,#ff0000
48145.0,"TOBACCO, NOT STEMMED/STRIPPED",240110,25.0,0.04023855188752281,#ff0000
12079062.0,"TOBACCO, PARTLY OR WHOLLY STEMMED/STRIPPED",240120,25.0,1.2832223242474996,#ff0000
176331.0,TOBACCO REFUSE (WASTE),240130,25.0,1.023381995694426,#ff0000
1062775.0,"CIGARS, CHEROOTS & CIGARILLOS, CONTAINING TOBACCO",240210,25.0,6.804693094911631,#ff0000
72397036.0,CIGARETTES CONTAINING TOBACCO,240220,25.0,28.964530492163565,#ff0000
2942.0,CIGAR/CHEROOT/CIGARILLO/CIGS OF TOB SUBSTITS NESOI,240290,25.0,0.029232894856471153,#ff0000
4985.0,WATER PIPE TOBACCO SPECIFIED SUBHEAD NOTE 1 CH 24,240311,25.0,0.10084576929239246,#ff0000
1128386.0,SMOKING TOBACCO W/ OR W/O TOBACCO SUBSTITUTE NESOI,240319,25.0,0.9635555689450794,#ff0000
561504.0,HOMOGENIZED OR RECONSTITUTED TOBACCO,240391,25.0,1.2672361221875938,#ff0000
5301446.0,MFR TOBACCO & SUBSTITUTES NESOI; TOBACCO EXTR ETC.,240399,25.0,36.563897950545574,#ff0000
0.0, ,240411,25.0,0.0,#EE1C25
5397416.0,NICOTINE PRODUCTS FOR INHALATION W/O COMBUST,240412,25.0,9.455696085221332,#ff0000
89901.0,"PRODUCTS FOR INHALATION WITHOUT COMBUSTION, NESOI",240419,25.0,5.583718827171229,#ff0000
7211253.0,NICOTINE PRODUCTS FOR ORAL INTAKE INTO HUMAN BODY,240491,25.0,50.182682634095485,#ff0000
945369.0,NICOTINE PRODUCTS FOR TRANSDERMAL INTAKE INTO BODY,240492,25.0,98.80053843565213,#ff0000
3267.0,NICOTINE PRODUCTS FOR INTAKE INTO HUMAN BODY NESOI,240499,25.0,0.4724716907458024,#ff0000
293277099.0,"SILICA SANDS AND QUARTZ SANDS, NATURAL",250510,25.0,33.18029990488571,#ff0000
290011979.0,PERFUMES AND TOILET WATERS,330300,25.0,13.978590025535715,#ff0000
161037167.0,LIP MAKE-UP PREPARATIONS,330410,25.0,31.915380160473966,#ff0000
139663188.0,EYE MAKE-UP PREPARATIONS,330420,25.0,33.04215857966269,#ff0000
55682444.0,MANICURE OR PEDICURE PREPARATIONS,330430,25.0,29.42097461207614,#ff0000
83944569.0,"POWDER MAKE-UP, ETC. PREPS, INCL ROUGE & BABY PWDR",330491,25.0,23.18863535844588,#ff0000
986689887.0,"BEAUTY & SKIN CARE PREPARATION, NESOI",330499,25.0,20.928864682169255,#ff0000
208756010.0,SHAMPOOS,330510,25.0,38.60319184524643,#ff0000
3511283.0,PREPARATIONS FOR PERMANENT WAVING OR STRAIGHTENING,330520,25.0,22.156497069438394,#ff0000
37543888.0,HAIR LACQUERS,330530,25.0,46.642852535493354,#ff0000
376543530.0,"PREPARATIONS FOR USE ON THE HAIR, NESOI",330590,25.0,36.13953074233429,#ff0000
122146382.0,DENTIFRICES,330610,25.0,49.97605190400139,#ff0000
34789997.0,YARN USED TO CLEAN BETWEN THE TEETH (DENTAL FLOSS),330620,25.0,64.59687600271154,#ff0000
31641606.0,"PRE-SHAVE, SHAVING OR AFTER-SHAVE PREPARATIONS",330710,25.0,35.112041954674275,#ff0000
124765587.0,PERSONAL DEODORANTS AND ANTIPERSPIRANTS,330720,25.0,38.40928694969643,#ff0000
21486689.0,PERFUMED BATH SALTS AND OTHER BATH PREPARATIONS,330730,25.0,40.16336728623487,#ff0000
2530165.0,ODORIFEROUS PREPARATIONS WHICH OPERATE BY BURNING,330741,25.0,39.571903716106846,#ff0000
110606730.0,PREPARATIONS FOR PERFUMING/DEODORIZING ROOMS NESOI,330749,25.0,38.82697655926013,#ff0000
197960882.0,"SOAP & OTH ORGANIC SURF ACT PROD, TOILET USE, BARS",340111,25.0,57.09620214085981,#ff0000
51711043.0,"SOAP & OTH ORGN SURF ACT PROD NOT TOILET USE,BARS",340119,25.0,67.3115379385611,#ff0000
38026536.0,SOAP IN FORMS NESOI,340120,25.0,32.79197839454216,#ff0000
322125421.0,"ORG. SUF0ACT PROD FOR WASHING SKIN, LIQ/CRM, RETAL",340130,25.0,45.98957686596459,#ff0000
4967979.0,CASEIN,350110,25.0,10.244456489384374,#ff0000
4215787.0,"EGG ALBUMIN, DRIED",350211,25.0,30.205644484959503,#ff0000
1724744.0,"OTHER EGG ALBUMIN, EXCEPT DRIED",350219,25.0,16.51201784213623,#ff0000
135913086.0,"MILK ALBUMIN,INC CONCEN OF 2 OR MORE WHEY PROTEINS",350220,25.0,16.824130420074415,#ff0000
139861379.0,"PEPTONES, OTHER PROTEINS & DERIV ETC; HIDE POWDER",350400,25.0,21.287734250685908,#ff0000
140411692.0,"FLOOR, WALL, ETC COVERS, VINYL CHLORIDE POLYMERS",391810,25.0,61.65978662519305,#ff0000
24146411.0,"FLOOR, WALL AND CEILING COVERS OF PLASTICS NESOI",391890,25.0,32.70653999114422,#ff0000
211045716.0,"PLATES, SHEET ETC PLAST, S-ADH, ROLLS NOV 20 CM W",391910,25.0,21.195975982243123,#ff0000
36926311.0,"BATHS, SHOWER BATHS,SINKS & WASHBASINS, OF PLASTIC",392210,25.0,73.21998086374262,#ff0000
19604324.0,"LAVATORY SEATS & COVERS, OF PLASTICS",392220,25.0,42.12651946494962,#ff0000
21374326.0,"BIDETS, LAVATORY PANS, SIMILR SANIT WARE, PLASTIC",392290,25.0,37.77325148157991,#ff0000
401872201.0,SACKS & BAGS (INCL CONES) OF POLYMERS OF ETHYLENE,392321,25.0,46.26778021870857,#ff0000
59763332.0,SACKS & BAGS (INCLUDING CONES) OF PLASTICS NESOI,392329,25.0,16.233008873514784,#ff0000
213456037.0,TABLEWARE AND KITCHENWARE OF PLASTICS,392410,25.0,45.05074380072391,#ff0000
212568431.0,HOUSEHOLD AND TOILET ARTICLES NESOI OF PLASTICS,392490,25.0,37.62552050009145,#ff0000
51616202.0,"RESERVOIRS, TANKS, ETC,OVER 300 LITERS, PLASTIC",392510,25.0,47.016147318166766,#ff0000
97353579.0,"DOORS, WINDOWS & THEIR FRAMES ETC, OF PLASTIC",392520,25.0,68.13729063434913,#ff0000
16635590.0,"SHUTTERS, BLINDS ETC & PTS OF PLASTICS",392530,25.0,16.667380528250558,#ff0000
227962004.0,"BUILDERS' WARE OF PLASTICS, NESOI",392590,25.0,59.37845670173295,#ff0000
674685138.0,"NEW PNEUMATIC TIRES OF RUBBER, FOR MOTOR CARS",401110,25.0,46.39758830435049,#ff0000
644736100.0,"NEW PNEUMATIC TIRES OF RUBBER, FOR BUSES OR TRUCKS",401120,25.0,35.77696451030504,#ff0000
0.0, ,401130,25.0,0.0,#EE1C25
19165872.0,"NEW PNEUMATIC TIRES, OF RUBBER, USED ON MOTORCYCLE",401140,25.0,64.61922447916375,#ff0000
13727457.0,"NEW PNEUMATIC TIRES, OF RUBBER, USED ON BICYCLES",401150,25.0,80.59458825386045,#ff0000
58432373.0,"NEW PNEUMATIC RUBBER TIRES,USED ON AG/FORESTRY VEH",401170,25.0,62.486484892241336,#ff0000
368367965.0,NEW PNEUMATC RUB TIRES USED ON CONSTRUC/MINING/IND,401180,25.0,28.0240965715718,#ff0000
20034523.0,"NEW PNEUMATIC TIRES OF RUBBER, NESOI",401190,25.0,8.696832244404106,#ff0000
53944.0,"RETREADED TIRES OF RUBBER, FOR USE ON MOTOR CARS",401211,25.0,0.9143900145301632,#ff0000
105105.0,"RETREADED TIRES OF RUBBER, FOR USE ON BUSES/TRUCKS",401212,25.0,5.043169589262734,#ff0000
0.0, ,401213,25.0,0.0,#EE1C25
1076554.0,"RETREADED TIRES OF RUBBER, NESOI",401219,25.0,29.062545724308137,#ff0000
2351975.0,USED PNEUMATIC TIRES OF RUBBER,401220,25.0,8.936186251250158,#ff0000
82822125.0,"SOLID OR CUSH TIRES, INTERCH TREADS, FLAPS, RUBBER",401290,25.0,71.53461265700719,#ff0000
46271027.0,"FLOOR COVERING & MAT, VULCANIZE RUB, EXC HARD RUB",401691,25.0,57.229877879816016,#ff0000
40485389.0,"SADDLERY, HARNESS, TRACES, LEADS ETC, ANY MATERIAL",420100,25.0,61.79157143896313,#ff0000
2618985.0,TRUNKS SUITCASES ETC SURFACE OF LEATHER/COMPOSITN,420211,25.0,20.143771512482864,#ff0000
41643487.0,"TRUNKS, SUITCASES,ETC,SURFACE PLASTIC/TEXT MATERLS",420212,25.0,18.27286542985552,#ff0000
3942165.0,"TRUNKS, SUITCASES, VANITY CASES ETC, NESOI",420219,25.0,16.51199431830224,#ff0000
75773544.0,HANDBAGS SURFACE OF LEATHER OR COMPOSITION LEATHER,420221,25.0,32.37387140870844,#ff0000
70764342.0,"HANDBAGS, SURFACE OF PLASTIC SHEET/TEXT MATERIALS",420222,25.0,53.84862923963545,#ff0000
2155442.0,"HANDBAGS, NESOI",420229,25.0,8.348265466105634,#ff0000
13901212.0,ARTICLES FOR POCKET OR HANDBAG OF LEATHER/COMPOSIT,420231,25.0,38.56969942812227,#ff0000
62507402.0,"ARTICLES FOR POCKET/HANDBAG, PLASTIC/TEXT MATERIAL",420232,25.0,70.88535324123849,#ff0000
1808541.0,"ARTICLES FOR POCKET OR HANDBAG, NESOI",420239,25.0,19.683677360877596,#ff0000
13220952.0,"CONTAINERS, BAGS, CASES ETC OF LEATHER/COMP NESOI",420291,25.0,29.12165800172497,#ff0000
185917847.0,"CONTAINER BAGS, CASES ETC NESOI, PLAST/TEXT MATER",420292,25.0,47.11187507180767,#ff0000
16601716.0,"CONTAINER BAGS, CASES ETC NESOI",420299,25.0,23.03080028947001,#ff0000
10178686.0,ARTICLES OF APPAREL OF LEATHER OR COMPOSIT LEATHER,420310,25.0,13.105232845675053,#ff0000
6752963.0,"GLOVES, MITTENS & MITTS FOR SPORTS, LEATH ETC",420321,25.0,52.97676862220501,#ff0000
14320038.0,"GLOVES, MITTENS & MITTS NOT FOR SPORTS, LEATH ETC",420329,25.0,54.61233922867903,#ff0000
14312222.0,BELTS & BANDOLIERS OF LEATHER OR COMPOSIT LEATHER,420330,25.0,46.34263911601945,#ff0000
646502.0,"CLOTHING ACCESS NESOI, LEATHER OR COMPOS LEATHER",420340,25.0,12.731873482002031,#ff0000
11952869.0,"ARTICLES OF LEATHER, NESOI",420500,25.0,30.85522439942137,#ff0000
8997.0,"ART. OF GUT (EXC SILKWRM),GLDBEATR SKIN,BLDDR,TNDN",420600,25.0,0.3137431860154999,#ff0000
58735493.0,"PINE WOOD SAWN/CHIPPED LNGTW, THICKNESS GT 6MM",440711,25.0,9.60224071437521,#ff0000
13758251.0,"FIR WOOD SAWN/CHIPPED, THICKNESS EXCEEDING 6MM",440712,25.0,27.510406244184416,#ff0000
21056257.0,"MIX SPF WOOD SAWN/CHIP LENGTHW,SLICED/PEEL,GT 6MM",440713,25.0,72.96770476884012,#ff0000
10120091.0,"MIX HEM-FIR WD SAWN/CHIP LENGTHW,SLICE/PEEL,GT 6MM",440714,25.0,49.858092925387446,#ff0000
88190586.0,"OTHER CONIF WOOD, SAWN/CHIPED LENTGW, THKNS GT 6MM",440719,25.0,47.03605990051227,#ff0000
576518.0,"MAHOGANY, SAWN/CHIPPED LENGTHWISE, SLICED/PEELED",440721,25.0,28.468112758846814,#ff0000
97077.0,"VIROLA, IMBUIA & BALSA SAWN/CHIPPD LNWS, SLICD/PLD",440722,25.0,0.7471869366628667,#ff0000
820655.0,"TEAK WOOD SAWN/CHIP LENGTHW,SLICED/PEEL,GT 6MM THK",440723,25.0,55.71789866757193,#ff0000
0.0, ,440725,25.0,0.0,#EE1C25
0.0, ,440726,25.0,0.0,#EE1C25
1256400.0,"SAPELLI, SAWN/CHIPPED LENGTHWISE, SLICED/PEELED",440727,25.0,48.51633989704373,#ff0000
55864.0,"IROKO SAWN OR CHIPPED LENGTHWISE, SLICED OR PEELED",440728,25.0,35.86382224733095,#ff0000
2280489.0,"OTHER TROPICAL WOOD,WOOD SAWN/CHIPPED LNGTHWSE ETC",440729,25.0,31.106342191602078,#ff0000
123961569.0,"OAK WOOD, SAWN, SLICED ETC, OVER 6 MM THICK",440791,25.0,14.243391191501997,#ff0000
200048.0,"BEECH WOOD, SAWN, SLICED ETC, OVER 6 MM THICK",440792,25.0,4.543759303954075,#ff0000
39077009.0,"MAPLE SAWN OR CHIPPED LENGTHWISE, SLICED OR PEELED",440793,25.0,42.73606629523033,#ff0000
2958946.0,"CHERRY, SAWN/CHIPPED LENGTHWISE, SLICED/PEELED",440794,25.0,2.8866260865384734,#ff0000
7918907.0,"ASH, SAWN OR CHIPPED LENGTHWISE, SLICED OR PEELED",440795,25.0,6.618348395037516,#ff0000
2347849.0,"BIRCH WOOD SAWN/CHIPPED, THICKNESS GT 6MM",440796,25.0,60.55666190624927,#ff0000
23230244.0,"POPLAR AND ASPEN WOOD SAW/CHIP LGTHW, THICK GT 6MM",440797,25.0,13.213077278074833,#ff0000
52409647.0,"NONCONIFEROUS WOOD NESOI, SAWN, SLICED ETC, OV 6MM",440799,25.0,12.507169745761605,#ff0000
13685829.0,"VENEER SHEET ETC, NOT OVER 6MM THICK, CONIFEROUS",440810,25.0,61.37979796348919,#ff0000
104842.0,"VEN/PLYWD SHEET SAW LNGTHWS NOV6MM, TROPICAL WOODS",440831,25.0,82.0488339333229,#ff0000
3763363.0,OTHER TROPICAL WOOD NESOI VEN/PLYWD SHT NOV6MM ETC,440839,25.0,38.393389098186184,#ff0000
129909612.0,"VENEER SHEET ETC, NOT OV 6MM, NONCONIFEROUS NESOI",440890,25.0,44.25111284080761,#ff0000
26244626.0,"WOOD, TONGUED, GROOVED, MOLDED ETC, CONIFEROUS",440910,25.0,59.75307750379436,#ff0000
221450.0,"BAMBOO CONT. SHAPED ALONG ANY EDGES, ENDS OR FACES",440921,25.0,32.795552422531706,#ff0000
508214.0,NONCONIF TROPICAL WOOD CONTINUOUSLY SHAPED,440922,25.0,18.39960435785629,#ff0000
26265356.0,NONCON WD EXC BAMBOO CONT SHPD ALNG EDGES ENDS ETC,440929,25.0,15.785097402887555,#ff0000
106823322.0,"PARTICLE BOARD, OF WOOD",441011,25.0,66.66941191474906,#ff0000
54876555.0,"ORIENTED STRAND BOARD (OSB), OF WOOD",441012,25.0,76.92650003510832,#ff0000
5338945.0,"WAFERBOARD AND SIMILAR BOARD, OF WOOD, NESOI",441019,25.0,82.57083278623215,#ff0000
