exports,description,hs-code,tariff,export_share,color
12732471.0,"MEN'S OR BOYS' GARMENTS, NOT KNIT, COATED ETC",621040,25.0,56.24907558249568,#ff0000
8544607.0,"WOMEN'S OR GIRLS' GARMENTS, NOT KNIT, COATED ETC",621050,25.0,56.89888985126832,#ff0000
4000099.0,"MEN'S OR BOYS' SWIMWEAR, NOT KNITTED OR CROCHETED",621111,25.0,37.08057232817682,#ff0000
615524.0,"WOMEN'S OR GIRLS' SWIMWEAR, NOT KNITTED OR CROCHET",621112,25.0,15.013132014798394,#ff0000
489907.0,"SKI-SUITS, NOT KNITTED OR CROCHETED",621120,25.0,38.6959821996286,#ff0000
32650280.0,"MEN'S OR BOYS' OTHER GARMENTS OF COTTON, NOT KNITT",621132,25.0,63.629979078681274,#ff0000
31525509.0,"MEN'S OR BOYS' OTHER GARMENTS MANMADE FIBERS, N KT",621133,25.0,47.15576852250925,#ff0000
2553133.0,"MEN'S OR BOYS' OT GARMENTS OT TEXTILE MTRL, N KNIT",621139,25.0,21.53795785073345,#ff0000
7674405.0,OTH GAR WOM GRLS COTTON EX TRACK SKI-SUITS SWMWER,621142,25.0,16.783013495004518,#ff0000
21674022.0,OTH GAR WOM GRLS MM FIB EX TRACK SKI-SUITS SWMWER,621143,25.0,28.909446459490066,#ff0000
7752949.0,OTH GAR WOM GRLS OTH TEX MTRLS EX WL AML HR CT MM,621149,25.0,18.761706632978456,#ff0000
48029969.0,"BRASSIERES, KNIT OR CROCHETED OR NOT",621210,25.0,26.32561390708044,#ff0000
2569616.0,"GIRDLES & PANTY GIRDLES, KNIT OR CROCHETED OR NOT",621220,25.0,24.20232702945882,#ff0000
481175.0,"CORSETS, KNITTED OR CROCHETED OR NOT",621230,25.0,19.538308362359437,#ff0000
2424235.0,BRACES SUSPENDERS GARTERS ART PARTS KT O CT,621290,25.0,6.480842598961615,#ff0000
260472.0,"HANDKERCHIEFS, OF COTTON",621320,25.0,33.02837448692735,#ff0000
427524.0,"HANDKERCHIEFS, OF OTHER TEXTILE MATERIALS",621390,25.0,33.32468109485893,#ff0000
2350156.0,"SHAWLS, SCARVES ETC OF SILK OR SILK WASTE NOT KNIT",621410,25.0,58.21697935366598,#ff0000
3572297.0,"SHAWLS SCARVES AND THE LIKE OF WOOL, NOT KNIT",621420,25.0,64.42950272386805,#ff0000
1409209.0,"SHAWLS SCARVES AND THE LIKE OF SYNTHETIC FIB, N KT",621430,25.0,42.124701112925585,#ff0000
277795.0,"SHAWLS SCARVES AND THE LIKE ARTIFICIAL FIBER, N KT",621440,25.0,40.575812991504925,#ff0000
386668.0,"SHAWLS SCARVES AND THE LIKE TEXTILE MTRL NESOI,NKT",621490,25.0,36.30065096856687,#ff0000
487364.0,"TIES, BOW TIES AND CRAVATS, OF SILK ETC, NOT KNIT",621510,25.0,52.73457745922615,#ff0000
605771.0,"TIES BOW TIES AND CRAVATS MANMADE FIBERS, NT KNIT",621520,25.0,26.388087242548103,#ff0000
152247.0,"TIES, BOW TIES AND CRAVATS, OF OTH TEXT, NOT KNIT",621590,25.0,45.53576235396864,#ff0000
13368779.0,"GLOVES, MITTENS AND MITTS, NOT KNIT OR CROCHETED",621600,25.0,43.2758344477258,#ff0000
9599384.0,OTH MADE-UP CLOTHING ACCESS NESOI,621710,25.0,21.601407926101164,#ff0000
1830701.0,"PARTS OF GARMENTS AND CLOTHING ACCESSORIES, NESOI",621790,25.0,3.65813126483611,#ff0000
1107595.0,"BLANKETS, ELECTRIC",630110,25.0,63.85938188267256,#ff0000
2333748.0,BLANKETS (NT ELEC) & TRAVELING RUGS OF WOOL HAIR,630120,25.0,46.53248683181834,#ff0000
3392811.0,BLANKETS (NT ELEC) & TRAVELING RUGS OF COTTON,630130,25.0,63.07883117877905,#ff0000
13418551.0,BLNKET (NT ELEC) & TRAVELING RUGS OF SYNTHETIC FIB,630140,25.0,62.38074437840917,#ff0000
1210487.0,OTHER BLANKETS AND TRAVELING RUGS,630190,25.0,36.826935275471776,#ff0000
4623280.0,"BED LINEN, KNITTED OR CROCHETED",630210,25.0,24.441600351540174,#ff0000
15114308.0,"BED LINEN, PRINTED, OF COTTON, NOT KNIT OR CROCHET",630221,25.0,75.5429734245995,#ff0000
3635386.0,"BED LINEN, PRINTED, OF MANMADE FIB, NOT KNIT ETC",630222,25.0,53.35345530776024,#ff0000
562085.0,"OTH BED LINEN, PRINTED, OF TEXTILE MATERIALS NESOI",630229,25.0,61.92184265637582,#ff0000
34730306.0,"BED LINEN NESOI, OF COTTON, NOT KNIT OR CROCHETED",630231,25.0,67.47424053194956,#ff0000
16970174.0,"BED LINEN NESOI, OF MANMADE FIBERS, NOT KNIT ETC",630232,25.0,53.591112467770266,#ff0000
2497311.0,"OTHER BED LINEN, OF TEXTILE MATERIALS NESOI",630239,25.0,30.56512866230999,#ff0000
245402.0,"TABLE LINEN, KNITTED OR CROCHETED",630240,25.0,30.1304167393114,#ff0000
2617265.0,"TABLE LINEN OF COTTON, NOT KNITTED OR CROCHETED",630251,25.0,42.60143225283905,#ff0000
3177826.0,"TABLE LINEN OF MANMADE FIBERS, NOT KNIT ETC",630253,25.0,49.12980750202838,#ff0000
803130.0,OTHER TABLE LINEN OF TEXTILE MATERIALS NESOI,630259,25.0,31.21498356523128,#ff0000
18240964.0,TOILET & KITCHEN LINEN OF COTTON TERRY FABRICS,630260,25.0,42.71276741720085,#ff0000
3767637.0,TOILET & KITCHEN LINEN OF COTTON FABRIC EXC TERRY,630291,25.0,31.542348426841237,#ff0000
4029502.0,TOILET & KITCHEN LINEN OF MANMADE FIBERS,630293,25.0,59.546295725717435,#ff0000
377923.0,TOILET & KITCHEN LINEN OF TEXTILES NESOI,630299,25.0,13.08200836588348,#ff0000
1255103.0,CURTAIN (DRAPE) & INTER BLND/BD VAL KT/CRO SYN FIB,630312,25.0,16.568380013388264,#ff0000
813127.0,CURT & INTR BLND CURT/BD VAL KT/CROC NESOI TEX MAT,630319,25.0,28.57878428742744,#ff0000
3329503.0,"CURTAIN & INTERIOR BLINDS/BED VALANCES, NESOI, COT",630391,25.0,64.4348308894437,#ff0000
40586877.0,"CURTAIN & INTER BLINDS/BED VALANCES, NESOI SYN FIB",630392,25.0,42.67583389018243,#ff0000
3151922.0,CURT & INT BLND CURT/BD VAL NESOI TEX MAT NT KT/CR,630399,25.0,19.57722702213629,#ff0000
252341.0,"BEDSPREADS, KNITTED OR CROCHETED TEXTILES",630411,25.0,46.97355537436848,#ff0000
1325912.0,"BEDSPREADS, NOT KNITTED OR CROCHETED TEXTILE",630419,25.0,39.899132151325844,#ff0000
0.0, ,630420,25.0,0.0,#EE1C25
2205529.0,OTH FURN ART EXC HEADING 9404 NESOI KNIT/CROCHETED,630491,25.0,55.60243583618737,#ff0000
5122857.0,OTHER FURNISH ART NT 9404 NESOI NT KT/CROCHET COT,630492,25.0,72.32695860390812,#ff0000
7783292.0,OTHER FURN ART NT 9404 NESOI NT KT/CROCHET SYN FIB,630493,25.0,60.39282963894078,#ff0000
2334703.0,OTH FURN ART EXC HEADNG 9404 NESOI N/KT/CR OTH MAT,630499,25.0,33.76053921933679,#ff0000
384198.0,SACK & BAG FOR PKG GOOD JUTE/BAST FIB OF HEAD 5303,630510,25.0,27.753534043043487,#ff0000
1165524.0,SACKS & BAGS KIND USED FOR PACKING OF GOODS COTTON,630520,25.0,38.312232181480866,#ff0000
9188786.0,"SACK & BAG FOR PKG GOOD MMADE MAT, FLEX BULK CONT.",630532,25.0,37.73246928934994,#ff0000
10865926.0,SACK & BAG FOR PKG GOOD MMADE MAT POLYETHYLENE,630533,25.0,40.74902666315551,#ff0000
5568364.0,SACK & BAG FOR PKG GOOD MANMADE TEXTILE MAT NESOI,630539,25.0,5.532508806278097,#ff0000
2270309.0,SACK & BAG USED FOR PACKING GOODS NESOI TEX MAT,630590,25.0,11.70519764810138,#ff0000
19058182.0,"TARPAULIN, AWNINGS AND SUNBLINDS OF SYNTHETIC FIB.",630612,25.0,61.28623391778301,#ff0000
3801205.0,"TARPAULINS, AWNINGS & SUNBLINDS: OF OTH TEX MAT",630619,25.0,51.631542087556724,#ff0000
16718775.0,"TENTS, OF SYNTHETIC FIBERS",630622,25.0,39.83309140660785,#ff0000
2721558.0,"TENTS, OF TEXTILE MATERIALS NESOI",630629,25.0,10.398197587371557,#ff0000
472236.0,"SAILS FOR BOATS, SAILBOARDS OR LANDCRAFT",630630,25.0,2.7048250469012527,#ff0000
4982004.0,PNEUMATIC MATTRESSES,630640,25.0,53.86942632458995,#ff0000
2353211.0,"CAMPING GOODS OF TEXTILES, NESOI",630690,25.0,36.00749831378218,#ff0000
19283903.0,"FLOORCLOTHS, DISHCLOTHS, DUSTERS ETC.",630710,25.0,17.31554539101709,#ff0000
4783151.0,"LIFE JACKETS AND LIFE BELTS, OF TEXTILE MATERIAL",630720,25.0,10.809229339611512,#ff0000
187710500.0,"MADE-UP TEXTILE ARTICLES, NESOI",630790,25.0,25.25755115242286,#ff0000
603848.0,"NEEDLECRAFT SETS OF WOV FABRIC & YARN, RETAIL PACK",630800,25.0,35.7800442859877,#ff0000
38618307.0,WORN CLOTHING AND OTHER WORN TEXTILE ARTICLES,630900,25.0,4.5605316216379554,#ff0000
1013054.0,"USED/NEW RAG, SCRP TWNE & WORN-OT ART TWNE ETC SOR",631010,25.0,4.365173819453625,#ff0000
1583268.0,"USE/NEW RAG, SCRP TWNE & WRN-OT ART TWNE ETC NESOI",631090,25.0,5.472688527007501,#ff0000
2756035.0,WATERPROOF FOOTWEAR RUBBER/PLASTIC A METAL TOE-CAP,640110,25.0,55.334434787811404,#ff0000
2223779.0,"RUB OR PLAST BONDED BOOTS NESOI, ANKL COV NOT KNEE",640192,25.0,41.895369856639164,#ff0000
863025.0,SHOES RUB PLAST NO STITCH NOT OVER ANKLE NESOI,640199,25.0,35.29985602329805,#ff0000
7625422.0,"OTH FTWR RUB/PLAS SKI,CROSS-CTY & SNOWBOARD BOOTS",640212,25.0,76.30201558256091,#ff0000
6489149.0,FOOTWEAR RUB PLAST STITCH SPORTS FOOTWEAR NESOI,640219,25.0,45.77117294877873,#ff0000
2129191.0,OTH FTWR W/UPPR STRAP ASSMB TO SOLE BY PLUG(ZORIS),640220,25.0,19.234509884693633,#ff0000
17976295.0,"FOOTWEAR O SOLE UPP RUB OR PLAST NESOI, ANKL COVRD",640291,25.0,57.853816335685146,#ff0000
83709393.0,"FOOTWEAR, OUTER SOLE & UPPER RUBBER OR PLAST NESOI",640299,25.0,57.37032114515747,#ff0000
67538.0,"FTWR W/LTHR UPP,SKI,CROSS-CTY & SNOWBOARD BOOTS",640312,25.0,4.1297440876994305,#ff0000
5446751.0,"FOOTWEAR LEA UPPER, SPORTS FOOTWEAR EXC SKI-BOOTS",640319,25.0,40.92698793504101,#ff0000
419067.0,FTWR SOL LTHR UPPER LTHR STRAPS AND AROUND BIG TOE,640320,25.0,6.397849322829511,#ff0000
8180950.0,FOOTWEAR LEA UPPER NESOI WITH A METAL TOE-CAP,640340,25.0,35.088952604018516,#ff0000
6617151.0,"FOOTWEAR, OUTER SOLE & UPP LEA NESOI, ANKLE COVERD",640351,25.0,43.27779465524566,#ff0000
11049576.0,"FOOTWEAR, OUTER SOLE & UPPER OF LEATHER NESOI",640359,25.0,38.62035932363055,#ff0000
49290888.0,"FOOTWEAR, OUT SOLE RUB ETC & UP LEA NESOI, ANK COV",640391,25.0,45.275734451220586,#ff0000
63880065.0,"FOOTWEAR, OUTER SOLE RUB ETC & LEATHER UPPER NESOI",640399,25.0,29.281289106616125,#ff0000
54613963.0,FOOTWEAR TEX UP RUBPLAS SOL SPORT SHOES,640411,25.0,49.0564953914987,#ff0000
56509025.0,"FOOTWEAR, OUT SOLE RUB OR PLAST & TEXT UPPER NESOI",640419,25.0,42.51712637983566,#ff0000
2648118.0,"FOOTWEAR, OUT SOLE LEA OR COMP LEA & TEXTILE UPPER",640420,25.0,32.92069511784723,#ff0000
1280257.0,"FOOTWEAR NESOI, UPPERS OF LEATHER OR COMP LEATHER",640510,25.0,3.479782945359702,#ff0000
5867588.0,"FOOTWEAR NESOI, UPPERS OF TEXTILE MATERIALS",640520,25.0,18.13011669872876,#ff0000
8875252.0,FOOTWEAR NESOI,640590,25.0,8.600965156914363,#ff0000
4731612.0,"HATS&OTHR HDGR,PLAITD/ASSEMBLD STRIPS ANY MATERIAL",650400,25.0,24.07825688436614,#ff0000
89342376.0,"HATS, OTHER HEADGEAR KNIT/CROCHETED, ETC; HAIRNETS",650500,25.0,41.744070796509796,#ff0000
71458613.0,"SAFETY(INCL SPORTS)HDGR,WHETHER/NOT LINED/TRIMMED",650610,25.0,29.537848775662994,#ff0000
1374510.0,OTHER HEADGR OF RUBBER/PLASTICS(INCL BATHING CAPS),650691,25.0,17.856885347937805,#ff0000
1242307.0,OTHR HEADGR OTHR MATRLS NESOI WHETHER/NOT LINE/TRM,650699,25.0,10.989699923524574,#ff0000
49138150.0,CERAMIC SANITARY FIXTURES OF PORCELAIN OR CHINA,691010,25.0,76.51852041370329,#ff0000
40017821.0,CERAMIC SANITARY FIXTURES OTH THN OF PORCLN/CHINA,691090,25.0,90.76456754804042,#ff0000
1440217.0,"GLASSWR OF GLS-CERAMICS FOR TABLE, KITCHN, OFF ETC",701310,25.0,10.955187180345947,#ff0000
242073.0,STEMWARE DRINKING GLASSES OF LEAD CRYSTAL,701322,25.0,12.917187378270878,#ff0000
8648622.0,"STEMWARE DRINKING GLASSES, NES",701328,25.0,55.29259718742797,#ff0000
183824.0,DRINKING GLASS OF LEAD CRYSTAL OTHER THAN STEMWARE,701333,25.0,8.468790959202618,#ff0000
23772111.0,"DRINKING GLASSES, NES",701337,25.0,73.9256596563978,#ff0000
138523.0,TBL O KTCHN GLSSWR NT DRNKNG GLSS OF LEAD CRYSTAL,701341,25.0,11.842619340531197,#ff0000
1668523.0,HH GLSWR NT DRNK GLS LNR COEF EXP NOV 5X/-6/KV ETC,701342,25.0,62.22026902204212,#ff0000
43130477.0,TABLE OR KITCHEN GLASSWARE NESOI,701349,25.0,56.50849690121862,#ff0000
678672.0,"OTHER GLASSWARE, LEAD CRYSTAL, NESOI",701391,25.0,23.55019118186446,#ff0000
37683042.0,"OTHER GLASSWARE, NOT LEAD CRYSTAL, NESOI",701399,25.0,75.22888306763889,#ff0000
121615525.0,"DIAMONDS, NONINDUSTRIAL, WORKED",710239,25.0,0.9930120256016605,#ff0000
258972688.0,"SILVER, UNWROUGHT NESOI",710691,25.0,58.49598307620828,#ff0000
225677913.0,"SILVER, SEMIMANUFACTURED",710692,25.0,55.404016128639256,#ff0000
469966419.0,"PALLADIUM, UNWROUGHT OR IN POWDER FORM",711021,25.0,19.662696742951532,#ff0000
37212747.0,"PALLADIUM, SEMIMANUFACTURED",711029,25.0,37.97354391444234,#ff0000
142529476.0,"JEWELRY AND PARTS THEREOF, OF SILVER",711311,25.0,24.38673404903639,#ff0000
540961733.0,"JEWELRY AND PARTS THEREOF, OF OTH PRECIOUS METAL",711319,25.0,5.115474853110533,#ff0000
3418502.0,"JEWELRY AND PARTS, BASE METAL CLAD W PREC METAL",711320,25.0,5.8591750625702455,#ff0000
320678182.0,"OTH PREC METL ARTCLS OR ARTCLS CLAD W PM, NESOI",711590,25.0,28.028281923930425,#ff0000
42469749.0,"OTH IMITATION JEWELRY, BASE METAL, INC PR MTL PLTD",711719,25.0,22.534667711201823,#ff0000
73921886.0,"COOKING APPLIANCES ETC FOR GAS FUEL, IRON OR STEEL",732111,25.0,57.03932278705324,#ff0000
963959.0,"COOKNG APPLNCS AND PLT WRMRS, IRN/STL FOR LIQ FUEL",732112,25.0,37.23919862780851,#ff0000
12592868.0,"COOK APP & PLATE WARMRS, NONELEC, OF IRN/STL NESOI",732119,25.0,34.920717936223554,#ff0000
23653572.0,NONELC DOM APPL NESOI IOS GAS OR GAS A OTH FUEL,732181,25.0,75.88965661153834,#ff0000
963473.0,NONELC DOM APPL NESOI IOS LIQUID FUEL,732182,25.0,72.08381558894538,#ff0000
11087008.0,"NONELECTRIC DOMESTIC APPL, OF IRON OR STEEL, NESOI",732189,25.0,71.68388406240884,#ff0000
3572666.0,"HANDSAWS AND PARTS EXCEPT BLADES, BASE METAL",820210,25.0,41.001432831641424,#ff0000
58093556.0,"PLIERS, PINCERS, TWEEZERS ETC & PTS, BASE METAL",820320,25.0,40.88763285415032,#ff0000
41707954.0,"SPANNERS AND WRENCHES, HAND-OPERATED NONADJ, PARTS",820411,25.0,23.93612507016768,#ff0000
19184623.0,"HND-OP SPNRS A WRNCHES ADJUSTBLE,PTS,BS MTL",820412,25.0,41.639076935224715,#ff0000
38760801.0,"SCKT WRNCHS W/WO HNDLS,DRVS,A EXTNSNS,PTS, BS MTL",820420,25.0,48.49281175229282,#ff0000
4436557.0,"DRILLING, THREADING OR TAPPING TOOLS A PTS, BS MTL",820510,25.0,22.91088726970955,#ff0000
14705215.0,"HAMMERS A SLEDGE HAMMERS A PARTS, BASE METAL",820520,25.0,55.88738907057039,#ff0000
2155090.0,"PLNS CHSLS A SMLR CTTNG TLS FR WDWRKNG,PTS,BS MTL",820530,25.0,43.09390519656799,#ff0000
16328533.0,"SCREWDRIVERS, AND PARTS, BASE METAL",820540,25.0,49.31938122869815,#ff0000
10846280.0,"HOUSEHOLD HAND TOOLS NESOI AND PARTS, BASE METAL",820551,25.0,20.097508384647114,#ff0000
95406502.0,"HANDTOOLS NESOI, AND PARTS, OF BASE METAL",820559,25.0,24.541487069650174,#ff0000
7092228.0,"BLOW TORCHES A SMLR SELF-CNTND TORCHES, PARTS",820560,25.0,75.86089236795715,#ff0000
34474859.0,"VISES, CLAMPS AND THE LIKE, AND PARTS, BASE METAL",820570,25.0,35.942355544736486,#ff0000
9562110.0,"TOOLS OF 2 OM OF HDG 8202-8205, STS FR RTAIL SALE",820600,25.0,19.03824594665932,#ff0000
5266399.0,"STS ASSTD KNVS, BLDS A BM PTS, NT KNVS OF 8208",821110,25.0,57.928242179344835,#ff0000
5427678.0,TABLE KNIVES HAVING FIXED BLADES AND PARTS,821191,25.0,64.22293448540746,#ff0000
19560027.0,"KNVS HVG FXD BLDS EXC TBL KNVS, PTS",821192,25.0,56.442488530879075,#ff0000
23205465.0,KNVS HVG OTH TH FXD BLDS A PTS EXC BLDS,821193,25.0,26.05681306712716,#ff0000
3327291.0,"BLADES FOR KNIVES, NESOI",821194,25.0,22.261259836967092,#ff0000
343673.0,HANDLES BS MTL FR KNIVES WTH CUTTNG BLADES NT 8208,821195,25.0,20.163893644559543,#ff0000
33493912.0,RAZORS,821210,25.0,50.805164004912406,#ff0000
5656122.0,SAFETY RAZOR BLADES AND BLADE BLANKS IN STRIPS,821220,25.0,3.4420772809646283,#ff0000
64085930.0,PARTS FOR RAZORS EXC BLADES,821290,25.0,88.74703755581368,#ff0000
7016398.0,"SCSSRS,TLRS A SMLR SHRS, BLDS A OTH BS MTL PTS",821300,25.0,37.715924995365064,#ff0000
601892.0,"PPR KNVS LTR OPNRS ERSNG KNVS PNCL SHPNRS, BM PTS",821410,25.0,28.89752022469213,#ff0000
6108234.0,MNCR OR PDCR STS A INSTMNTS INC NL FLS A PTS,821420,25.0,36.3268319042036,#ff0000
1316102.0,ARTICLES OF CUTLERY NESOI A BASE METAL PARTS,821490,25.0,13.370837861896451,#ff0000
265114.0,STS ASSTD TBLWR AT LST 1 PREC MTL PLTD,821510,25.0,22.81088187667459,#ff0000
4930868.0,SETS ASSRTD TBLWR NOT PREC MTL,821520,25.0,60.75279296604036,#ff0000
150323.0,"SPNS FRKS LDLS ETC, BS MTL PTS, PRC MTL PLTD,NT ST",821591,25.0,11.233316071197716,#ff0000
8135727.0,"SPNS FRKS LDLS ETC,BS MTL PTS,NT PRC MTL PLT,NT ST",821599,25.0,52.8913132854487,#ff0000
31589414.0,PADLOCKS OF BASE METAL,830110,25.0,42.934171058564544,#ff0000
95419125.0,"LOCKS EXCEPT MOTOR VEHICLE OR FURNITURE, BASE METL",830140,25.0,36.87070553000893,#ff0000
777447.0,"CLASPS AND FRAMES W CLASPS, INC LOCKS, BASE METAL",830150,25.0,26.18895872338734,#ff0000
80148368.0,"HAT-RACKS HAT PEGS BRCKTS ETC PARTS, BASE METAL",830250,25.0,38.228158096260586,#ff0000
39919385.0,"TABLE, FLOOR ETC FANS ELECTRIC NOT EXCEED 125 W",841451,25.0,32.11651642966547,#ff0000
116862152.0,REFRIG-FREEZERS W/ SEPARATE EXTERNAL DOORS/DRAWERS,841810,25.0,61.28707450976015,#ff0000
38724126.0,"REFRIGERATORS, HOUSEHOLD, COMPRESSION TYPE",841821,25.0,52.2617238749656,#ff0000
2429632.0,"REFRIGERATORS, HOUSEHOLD TYPE, NESOI",841829,25.0,15.30464992302737,#ff0000
4425387.0,"FREEZERS, CHEST TYPE, CAPACITY NOT EXC 800 LITERS",841830,25.0,36.07408259402875,#ff0000
42042634.0,"FREEZERS, UPRIGHT, CAPACITY NOT EXC 900 LITERS",841840,25.0,39.259201744403775,#ff0000
138849412.0,REFRIGERATING/FREEZING DISPLAY COUNTERS ETC,841850,25.0,57.894460815491186,#ff0000
468020511.0,"REFRIGERATING/FREEZING EQUIPMENT, NESOI",841869,25.0,31.849259864689778,#ff0000
136780666.0,MACHINERY ETC FOR MAKING HOT DRINKS COOKING HEATNG,841981,25.0,18.60330572441481,#ff0000
148998272.0,"DISHWASHING MACHINES, HOUSEHOLD TYPE",842211,25.0,93.16766687798255,#ff0000
98058539.0,SNOWPLOWS AND SNOWBLOWERS,843020,25.0,71.54028148842684,#ff0000
292331992.0,"MOWERS FOR LAWNS, PARKS ETC CUT DEVICE HORIZ PLANE",843311,25.0,35.41794676426767,#ff0000
37973294.0,MOWERS FOR LAWNS EXC PWRD W HORZNTL ROTATING CUTTR,843319,25.0,16.670322156606808,#ff0000
42614451.0,"MOWERS, NESOI, INC CUTTER BAR FOR TRACTOR MOUNTING",843320,25.0,63.597175093941914,#ff0000
44979027.0,WASHING MACH AUTOMATIC W DRY LINE CAP NOT OV 10KG,845011,25.0,39.2786229661313,#ff0000
81528.0,"WASH MAC WITH BLT-IN CENT DRY,CAP NOT EXC 10 KG",845012,25.0,4.7737325262348005,#ff0000
678100.0,"WASH MACH, CAPACITY NOT EXC 10 KG, HOUSEHOLD,NESOI",845019,25.0,36.06266532931845,#ff0000
129174897.0,WASHING MACHINES WITH DRY LINEN CAPACITY OV 10 KG,845020,25.0,49.646068313620965,#ff0000
11119613.0,DRYING MACHINES WITH DRY LINEN CAPACITY N OV 10KG,845121,25.0,45.23700602124692,#ff0000
72146460.0,DRYING MACHINES WITH DRY LINEN CAPACITY OVER 10 KG,845129,25.0,45.404494791021335,#ff0000
22277754.0,PNEUMATIC ROTARY TYPE TOOLS FOR WORK IN THE HAND P,846711,25.0,23.411617990813312,#ff0000
37905828.0,PNEUMATIC EX ROTARY TYPE TOOLS FOR WORK IN HAND,846719,25.0,44.57783437390697,#ff0000
58188823.0,"DRILLS, W/ SELF-CONT. ELECTRIC MOTOR, WK IN HAND",846721,25.0,61.37369101660946,#ff0000
109522663.0,"SAWS W/ SELF-CONT. ELECTIRIC MOTORS, FOR WK IN HND",846722,25.0,85.47295813193496,#ff0000
466855138.0,"TOOLS FOR WK IN  HAND,W/ SELF-CONT ELEC MOTOR,NESO",846729,25.0,66.69943706266096,#ff0000
10487883.0,CHAIN SAWS,846781,25.0,33.34232602768582,#ff0000
38297591.0,TOOLS WORK IN SELF-CONT NONELECTRIC MTR NESOI,846789,25.0,33.31130357982914,#ff0000
63442950.0,VAC CLN W/SLF-CNT ELEC MOT PWR LT=1500W CAP LT=20L,850811,25.0,28.164770094666785,#ff0000
20374617.0,"VACUUM CLEANER W/ SELF-CONTAINED ELEC MOTOR, NESOI",850819,25.0,55.102620180870886,#ff0000
8603688.0,VACUUM CLEANERS W/O SELF-CONTAINED ELECTRIC MOTOR,850860,25.0,43.77527733615641,#ff0000
104748195.0,ELECTROMECH FOOD GRINDER PROCESSOR MIXER EXTRCTOR,850940,25.0,22.825627570120066,#ff0000
148221929.0,ELECTROMECH DOMESTC APPL SLF-CONT ELECTR MTR NESOI,850980,25.0,62.318143030284666,#ff0000
29844648.0,ELECTRIC SHAVERS,851010,25.0,71.91049809516254,#ff0000
19913350.0,ELECTRIC HAIR CLIPPERS,851020,25.0,23.090803682325337,#ff0000
5138938.0,"HAIR-REMOVING APPLIANCES, W/ SELF-CONT ELEC MOTOR",851030,25.0,85.43912816788634,#ff0000
8308795.0,ELECTRIC HAIR DRYERS,851631,25.0,29.852396038145468,#ff0000
23225225.0,ELECTROTHERMIC HAIRDRESSING APPARATUS NESOI,851632,25.0,29.281431061267167,#ff0000
3794797.0,ELECTRIC HAND-DRYING APPARATUS,851633,25.0,34.17194296483173,#ff0000
2867287.0,ELECTRIC FLATIRONS,851640,25.0,22.9594866878334,#ff0000
25223869.0,MICROWAVE OVENS,851650,25.0,49.28541540577784,#ff0000
319754774.0,"OVEN,COOKING STOVE & PLATE,RANGE,ROASTER, NESOI",851660,25.0,79.21230301720992,#ff0000
31780201.0,ELECTRIC COFFEE OR TEA MAKERS,851671,25.0,58.32281813340745,#ff0000
4091607.0,ELECTRIC TOASTERS,851672,25.0,40.81469446189555,#ff0000
50990194.0,"OTHER ELECTROTHERMIC APPLIANCES, DOMESTIC",851679,25.0,47.07207282057963,#ff0000
86008717.0,ELECTRIC HEATING RESISTORS,851680,25.0,14.380747418904082,#ff0000
6513352.0,"E-CIGARETTES, SIM PERSONAL ELEC VAPORIZING DEVICES",854340,25.0,16.860734545718493,#ff0000
181394.0,"MOTOCYCLES (INCL MOPEDS),PIST,ENG,CYL,NOT,EXC 50CC",871110,25.0,2.821369078078606,#ff0000
1231839.0,"MOTORCYCLES (INCLUDING MOPEDS),CYCL,EXC50CC,NT250C",871120,25.0,7.301568465715071,#ff0000
2917076.0,"MOTORCYCLES (INCLUDING MOPEDS),CYCL,EXC250CC,NT500",871130,25.0,6.812005275535283,#ff0000
4982248.0,"MOTORCYCLES, CYCL, EXC 500, NT 800 CC",871140,25.0,21.130199018160507,#ff0000
175645376.0,"MOTORCYCLES, CYCL,EXCD 800 CC",871150,25.0,35.63211182372838,#ff0000
68742414.0,MOTORCYCLES WITH ELECTRIC MOTOR FOR PROPULSION,871160,25.0,71.91865764448764,#ff0000
1150302.0,"MOTORCYCLES (INCLUDING MOPEDS), NESOI, SIDE CARS",871190,25.0,3.14819154732155,#ff0000
2640.0,UNMANNED AIRCRAFT FOR THE CARRIAGE OF PASSENGERS,880610,25.0,0.36438571331954006,#ff0000
713660.0,RC UNMANNED AIRCR FLIGHT MAX TAKEOFF NOT OVER 250G,880621,25.0,4.043007044132204,#ff0000
2542665.0,RC UNMANNED AIRCRAFT MAX TAKE-OFF WT 250G - 7KG,880622,25.0,3.036791304140012,#ff0000
2963493.0,RC UNMANNED AIRCRAFT MAX TAKE-OFF WT 7KG - 25KG,880623,25.0,12.506820527440055,#ff0000
1048062.0,RC UNMANNED AIRCRAFT MAX TAKE-OFF WT 25KG - 150KG,880624,25.0,1.898188737006349,#ff0000
1934557.0,RC UNMANNED AIRCRAFT MAX TAKE-OFF WT GT 150 KG,880629,25.0,3.2062932253641825,#ff0000
0.0, ,880691,25.0,0.0,#EE1C25
918261.0,UNMANNED AIRCRAFT MAX TAKE-OFF WT 250G - 7KG NESOI,880692,25.0,4.680291618558228,#ff0000
64782.0,UNMANNED AIRCRAFT MAX TAKE-OFF WT 7KG - 25KG NESOI,880693,25.0,13.850179803050452,#ff0000
568004.0,UNMANNED AIRCRAFT MAX TAKE-OFF WT 25KG - 150KG NES,880694,25.0,20.418944908780446,#ff0000
25073.0,"UNMANNED AIRCRAFT MAX TAKE-OFF WT GT 150 KG, NESOI",880699,25.0,0.056505600202359146,#ff0000
5767939.0,"REVOLVERS & PISTOLS, DESIGNED TO FIRE LIVE AMMO",930200,25.0,3.9294432927546126,#ff0000
1095960.0,MUZZLE-LOADING FIREARMS,930310,25.0,92.37522567855282,#ff0000
14262917.0,SPORT HUNT TARGET-SHOOT SHOTGUN EX MUZZLE-LOADING,930320,25.0,63.747837776787144,#ff0000
53154488.0,SPORT HUNT TARGET-SHOOT RIFLES EX MUZZLE-LOADING,930330,25.0,38.23321857886617,#ff0000
451952.0,VERY PISTOLS REV FIRING BLANK AMMNTN LINE-THRW GUN,930390,25.0,5.163013180333502,#ff0000
23053083.0,"ARMS NESOI, OTHER THAN SIDE ARMS AND SIMILAR ARMS",930400,25.0,26.027575198173196,#ff0000
16306973.0,SHOTGUN CARTRIDGES,930621,25.0,49.81460243241193,#ff0000
3381916.0,AIR GUN PELLETS AND PARTS OF SHOTGUN CARTRIDGES,930629,25.0,57.76730811835316,#ff0000
110263813.0,"CARTRIDGES AND PARTS THEREOF, NESOI",930630,25.0,15.970973456802254,#ff0000
5985822.0,WOODEN SWIVEL SEATS W/ VARIABLE HEIGHT ADJUSTMENT,940131,25.0,64.8306813987381,#ff0000
83331371.0,SWIVEL SEATS WITH VARIABLE HEIGHT ADJUSTMENT NESOI,940139,25.0,45.786809222455624,#ff0000
15788845.0,"WOODEN SEATS CONVERT TO BEDS, NT GARDEN/CAMPING EQ",940141,25.0,82.41973328088153,#ff0000
5005122.0,SEATS CONVERT TO BEDS NOT GARDEN/CAMPING EQUIP NES,940149,25.0,82.60404513949345,#ff0000
179617.0,SEATS OF BAMBOO,940152,25.0,40.727354355668524,#ff0000
1489779.0,SEATS OF RATTAN,940153,25.0,70.06665785608432,#ff0000
189182.0,"SEATS OF CANE, OSIER OR SIMILAR MATERIALS, NESOI",940159,25.0,13.934057354560487,#ff0000
431888218.0,"SEATS W WOODEN FRAMES, UPHOLSTERED, NESOI",940161,25.0,79.80440856383387,#ff0000
34391079.0,"SEATS W WOODN FRAMES, NOT UPHOLSTERED, NESOI",940169,25.0,56.948704653843215,#ff0000
97241710.0,"SEATS WITH METAL FRAMES, UPHOLSTERED,NESOI",940171,25.0,62.08319550965838,#ff0000
65967312.0,"SEATS WITH METAL FRAMES, EXCEPT UPHOLSTERED NESOI",940179,25.0,57.68938990735075,#ff0000
91643681.0,"SEATS OTHER THAN OF METAL OR WOODEN FRAMES, NESOI",940180,25.0,61.67880500405809,#ff0000
92161401.0,"METAL FURNITURE EXCEPT SEATS, USED IN OFFICES",940310,25.0,57.28673735595069,#ff0000
398884061.0,METAL FURNITURE NESOI,940320,25.0,48.61601494194984,#ff0000
73641425.0,"WOODEN OFFICE FURNITURE, EXCEPT SEATS",940330,25.0,65.42866518821239,#ff0000
39194840.0,"WOODEN KITCHEN FURNITURE, EXCEPT SEATS",940340,25.0,61.51963810766233,#ff0000
154026959.0,"WOODEN BEDROOM  FURNITURE, EXCEPT SEATS",940350,25.0,79.09380353414811,#ff0000
326095488.0,"WOODEN FURNITURE, NESOI",940360,25.0,64.05375570839854,#ff0000
77000037.0,"FURNITURE OF PLASTICS, NESOI",940370,25.0,55.01268681254581,#ff0000
4714123.0,"FURNITURE OF BAMBOO, NESOI",940382,25.0,79.74313366775858,#ff0000
8047003.0,"FURNITURE OF RATTAN, NESOI",940383,25.0,92.35023160997942,#ff0000
60574407.0,"FURNITURE, NESOI",940389,25.0,31.523563656068088,#ff0000
3350088.0,MATTRESS SUPPORTS,940410,25.0,22.27653416289411,#ff0000
92865222.0,MATTRESS OF CELLULAR RUBBER OR PLASTICS,940421,25.0,79.60937910344906,#ff0000
40137201.0,MATTRESSES OF OTHER THAN CELLULAR RUB/PLASTICS,940429,25.0,55.99333005134294,#ff0000
25856361.0,"QUILTS,BEDSPREADS,EIDERDOWNS AND DUVETS/COMFORTERS",940440,25.0,72.62161901033079,#ff0000
109605103.0,OTH ART OF BEDDNG EX MATTRSS ETC INC PILLOWS/CUSHI,940490,25.0,61.81317215945688,#ff0000
227240808.0,"LED CHANDELIERS, OTHER ELEC CEILING/WALL LIGHTING",940511,25.0,67.1199018112934,#ff0000
107702555.0,"CHANDELIERS, OTH ELEC CEILING/WALL LIGHTING NESOI",940519,25.0,74.48937482689153,#ff0000
10824971.0,"LED ELEC TABLE,DESK,BEDSIDE,FLOOR-STANDING LIGHT",940521,25.0,50.171715182961094,#ff0000
22502697.0,"ELEC TABLE,DESK,BEDSIDE,FLOOR-STANDING LIGHT NESOI",940529,25.0,61.90755586074616,#ff0000
722142.0,LED CHRISTMAST TREE LIGHTING STRINGS,940531,25.0,2.312282391612023,#ff0000
1090997.0,"CHRISTMAS TREE LIGHTING STRINGS, NOT LED",940539,25.0,22.35803072546988,#ff0000
15744800.0,LED PHOTOVOLTAIC LUMINAIRES AND LIGHTING FITTINGS,940541,25.0,19.659870308637416,#ff0000
140380460.0,LED ELECTRIC LUMINAIRES AND LIGHTING FITTINGS,940542,25.0,39.172362955471264,#ff0000
